{
  "$schema": "https://json-schema.org/draft/2020-12/schema",
  "$id": "urn:automata:cloud-core:v1:shard-capabilities",
  "title": "Automata Core shard capabilities v1",
  "description": "Identity, release, endpoints, and protocol versions advertised by one load-balanced Automata Core shard.",
  "type": "object",
  "additionalProperties": false,
  "required": [
    "protocol_version",
    "shard_id",
    "release",
    "protocols",
    "public_endpoints",
    "server_time_ms"
  ],
  "properties": {
    "protocol_version": {
      "const": 1
    },
    "shard_id": {
      "type": "string",
      "minLength": 1,
      "maxLength": 63,
      "pattern": "^[a-z0-9](?:[a-z0-9-]{0,61}[a-z0-9])?$"
    },
    "release": {
      "type": "object",
      "additionalProperties": false,
      "required": ["version", "commit"],
      "properties": {
        "version": {
          "type": "string",
          "minLength": 1,
          "maxLength": 64,
          "pattern": "^[0-9A-Za-z][0-9A-Za-z.+-]*$"
        },
        "commit": {
          "type": "string",
          "minLength": 40,
          "maxLength": 64,
          "pattern": "^[0-9a-f]+$"
        }
      }
    },
    "protocols": {
      "type": "object",
      "additionalProperties": false,
      "required": [
        "delegated_actor",
        "core_http",
        "live_log",
        "usage_event",
        "entitlement"
      ],
      "properties": {
        "delegated_actor": { "$ref": "#/$defs/versionSet" },
        "core_http": { "$ref": "#/$defs/versionSet" },
        "page_model": { "$ref": "#/$defs/versionSet" },
        "live_log": { "$ref": "#/$defs/versionSet" },
        "usage_event": { "$ref": "#/$defs/versionSet" },
        "entitlement": { "$ref": "#/$defs/versionSet" }
      }
    },
    "public_endpoints": {
      "type": "object",
      "additionalProperties": false,
      "required": ["live_logs_origin"],
      "properties": {
        "live_logs_origin": {
          "type": "string",
          "format": "uri",
          "pattern": "^https://",
          "minLength": 9,
          "maxLength": 2048
        }
      }
    },
    "server_time_ms": {
      "type": "integer",
      "minimum": 0,
      "maximum": 9007199254740991
    }
  },
  "$defs": {
    "versionSet": {
      "type": "array",
      "minItems": 1,
      "maxItems": 8,
      "uniqueItems": true,
      "items": {
        "type": "integer",
        "minimum": 1,
        "maximum": 255
      }
    }
  }
}
