{
  "protocol_version": 1,
  "shard_id": "prod-us-east-1-001",
  "release": {
    "version": "0.1.0-alpha.1",
    "commit": "0123456789abcdef0123456789abcdef01234567"
  },
  "protocols": {
    "delegated_actor": [1],
    "core_http": [1],
    "page_model": [1],
    "live_log": [1],
    "usage_event": [1],
    "entitlement": [1]
  },
  "public_endpoints": {
    "live_logs_origin": "https://logs.us-east-1.automata.example"
  },
  "server_time_ms": 1786500060000
}
